{
  "format": "ekole.tandem-teacher-preview/1.0",
  "mode": "synthetic",
  "authority": "orgo",
  "tenant_id": "11111111-1111-4111-8111-111111111111",
  "world_id": "22222222-2222-4222-8222-222222222222",
  "world_release_id": "33333333-3333-4333-8333-333333333333",
  "scenario_ref": "fete-sorciere-synthetique",
  "workflow_ref": "fete-sorciere-v1",
  "tasks": [
    {
      "task_ref": "mission-sorciere",
      "role_code": "sorciere",
      "state": "ready",
      "fragment_refs": [
        "lanternes"
      ]
    },
    {
      "task_ref": "mission-marchand",
      "role_code": "marchand",
      "state": "waiting",
      "fragment_refs": []
    },
    {
      "task_ref": "mission-messager",
      "role_code": "messager",
      "state": "waiting",
      "fragment_refs": []
    },
    {
      "task_ref": "mission-organisateur",
      "role_code": "organisateur",
      "state": "blocked",
      "fragment_refs": []
    }
  ]
}
